{
	"project": {
		"authors": [
			"AthexWeb3 <athexweb3@gmail.com> (https://github.com/AthexWeb3)"
		],
		"description": "A simple plugin to demonstrate env-arch capability",
		"homepage": null,
		"license": "",
		"name": "simple-env-arch",
		"repository": "",
		"version": "0.1.0"
	},
	"platform": {
		"platforms": ["macos", "windows"],
		"architectures": ["aarch64", "arm64"]
	},
	"dependencies": {
		"env-arch": {
			"source": "",
			"version": ""
		}
	},
	"capabilities": [
		"ui-secret",
		"ui-interact",
		{
			"network": ["bind"]
		},
		{
			"fs-write": ["/src/bindings.rs"]
		}
	]
}
